<!ATTLIST enguany value (2025) #REQUIRED>
<!ELEMENT revista (article+)>
<!ELEMENT article (titol, autor, cos, etiquetes)>
<!ATTLIST article id ID #REQUIRED>
<!ELEMENT titol (#PCDATA)>
<!ELEMENT autor (#PCDATA)>
<!ELEMENT cos (#PCDATA)>
<!ELEMENT etiquetes (etiqueta+)>
<!ELEMENT etiqueta (#PCDATA)>